{
  "opendb_id": "1d8ea915-f952-42a6-ae23-3956eb4b0156",
  "power_connectors": {
    "pcie_6_pin": 0,
    "pcie_8_pin": 2,
    "pcie_12VHPWR": 0,
    "pcie_12V_2x6": 0
  },
  "metadata": {
    "name": "PowerColor Red Devil OC Radeon RX 7900 GRE 16GB GDDR6 Black / Red",
    "manufacturer": "PowerColor",
    "part_numbers": [
      "RX 7900 GRE 16G-E",
      "OC"
    ],
    "series": "Radeon RX 7900 GRE",
    "variant": "PowerColor"
  },
  "chipset_manufacturer": "Radeon",
  "chipset": "Radeon RX 7900 GRE",
  "memory": 16,
  "memory_type": "GDDR6",
  "core_base_clock": 1270,
  "core_boost_clock": 2391,
  "effective_memory_clock": 18000,
  "memory_bus": 0,
  "interface": "PCIe x16",
  "color": [
    "BLACK",
    "RED"
  ],
  "length": 345,
  "tdp": 260,
  "total_slot_width": 3,
  "cooling": "3 Fans",
  "video_outputs": {
    "hdmi_2_1": 1,
    "hdmi_2_0": 0,
    "displayport_2_1": 3,
    "displayport_2_1a": 0,
    "displayport_1_4a": 0,
    "dvi_d": 0,
    "vga": 0,
    "_id": "67f9c77f865ad0c3553eb95c"
  },
  "core_count": 5120,
  "general_product_information": {}
}