{
  "opendb_id": "18d6ca13-1ea2-496c-8ccd-d92b22461bcf",
  "power_connectors": {
    "pcie_6_pin": 0,
    "pcie_8_pin": 0,
    "pcie_12VHPWR": 0,
    "pcie_12V_2x6": 0
  },
  "metadata": {
    "name": "PowerColor AXRX 560 4GBD5-DHA Radeon RX 560 - 896 4GB GDDR5 Black",
    "manufacturer": "PowerColor",
    "part_numbers": [
      "AXRX 560 4GBD5-DHA"
    ],
    "series": "Radeon RX 560 - 896",
    "variant": "PowerColor"
  },
  "chipset_manufacturer": "Radeon",
  "chipset": "Radeon RX 560",
  "memory": 4,
  "memory_type": "GDDR5",
  "core_base_clock": 115,
  "core_boost_clock": 1176,
  "effective_memory_clock": 7000,
  "memory_bus": 0,
  "interface": "PCIe x16",
  "color": [
    "BLACK"
  ],
  "length": 225,
  "tdp": 75,
  "total_slot_width": 2,
  "cooling": "1 Fan",
  "video_outputs": {
    "hdmi_2_1": 0,
    "hdmi_2_0": 1,
    "displayport_2_1": 0,
    "displayport_2_1a": 0,
    "displayport_1_4a": 1,
    "dvi_d": 0,
    "vga": 0,
    "_id": "67f9c7d1865ad0c3553ebe91"
  },
  "core_count": 0,
  "general_product_information": {
    "amazon_sku": "B076F9KC7G"
  }
}