{
  "opendb_id": "17b9e0ed-da24-4994-b493-4d83e770a7f4",
  "power_connectors": {
    "pcie_6_pin": 0,
    "pcie_8_pin": 0,
    "pcie_12VHPWR": 1,
    "pcie_12V_2x6": 0
  },
  "metadata": {
    "name": "Palit GamingPro GeForce RTX 4070 Ti SUPER 16GB GDDR6X Black",
    "manufacturer": "Palit",
    "part_numbers": [
      "NED47TS019T2-1043A"
    ],
    "series": "GeForce RTX 4070 Ti SUPER",
    "variant": "Palit"
  },
  "chipset_manufacturer": "GeForce",
  "chipset": "GeForce RTX 4070 Ti SUPER",
  "memory": 16,
  "memory_type": "GDDR6X",
  "core_base_clock": 2340,
  "core_boost_clock": 2610,
  "effective_memory_clock": 0,
  "memory_bus": 0,
  "interface": "PCIe x16",
  "color": [
    "BLACK"
  ],
  "length": 329,
  "tdp": 285,
  "total_slot_width": 4,
  "cooling": "3 Fans",
  "video_outputs": {
    "hdmi_2_1": 1,
    "hdmi_2_0": 0,
    "displayport_2_1": 0,
    "displayport_2_1a": 0,
    "displayport_1_4a": 3,
    "dvi_d": 0,
    "vga": 0,
    "_id": "67f91dcfeb7c00c41ad73668"
  },
  "core_count": 8448,
  "general_product_information": {}
}