{
  "opendb_id": "c3efec88-7f1c-4363-a32a-039dcc2233b2",
  "power_connectors": {
    "pcie_6_pin": 0,
    "pcie_8_pin": 1,
    "pcie_12VHPWR": 0,
    "pcie_12V_2x6": 0
  },
  "metadata": {
    "name": "Palit Infinity 3 GeForce RTX 5060 8GB GDDR7",
    "manufacturer": "Palit",
    "part_numbers": [
      "NE75060019P1-GB2063S"
    ],
    "series": "GeForce RTX 5060",
    "variant": "Palit",
    "releaseYear": 2025
  },
  "chipset_manufacturer": "GeForce",
  "chipset": "GeForce RTX 5060",
  "memory": 8,
  "memory_type": "GDDR7",
  "core_base_clock": 2280,
  "core_boost_clock": 2497,
  "effective_memory_clock": 0,
  "memory_bus": 128,
  "interface": "PCIe 5.0 x16",
  "color": [],
  "length": 292,
  "tdp": 145,
  "total_slot_width": 2,
  "cooling": "3 Fans",
  "video_outputs": {
    "hdmi_2_1": 1,
    "hdmi_2_0": 0,
    "displayport_2_1": 3,
    "displayport_2_1a": 0,
    "displayport_1_4a": 0,
    "displayport_2_1_b": 3,
    "dvi_d": 0,
    "vga": 0,
    "_id": "684cd4121d3a20a8514d2fe7"
  },
  "core_count": 3840,
  "frame_sync": "G-Sync",
  "general_product_information": {}
}