{
  "opendb_id": "469dad4a-5b6e-4c6e-987d-900b395f9513",
  "power_connectors": {
    "pcie_6_pin": 0,
    "pcie_8_pin": 0,
    "pcie_12VHPWR": 0,
    "pcie_12V_2x6": 0
  },
  "metadata": {
    "name": "GALAX EX GeForce RTX 3050 6GB GDDR6 White",
    "manufacturer": "GALAX",
    "part_numbers": [
      "35NRLDMD9OEX"
    ],
    "series": "GeForce RTX 3050 6GB",
    "variant": "GALAX"
  },
  "chipset_manufacturer": "GeForce",
  "chipset": "GeForce RTX 3050 6 GB",
  "memory": 6,
  "memory_type": "GDDR6",
  "core_base_clock": 1040,
  "core_boost_clock": 1470,
  "effective_memory_clock": 0,
  "memory_bus": 0,
  "interface": "PCIe x16",
  "color": [
    "WHITE"
  ],
  "length": 209,
  "tdp": 70,
  "total_slot_width": 2,
  "cooling": "2 Fans",
  "video_outputs": {
    "hdmi_2_1": 1,
    "hdmi_2_0": 0,
    "displayport_2_1": 0,
    "displayport_2_1a": 0,
    "displayport_1_4a": 3,
    "dvi_d": 0,
    "vga": 0,
    "_id": "67f9c651865ad0c3553ea688"
  },
  "core_count": 0,
  "general_product_information": {}
}