{
  "opendb_id": "9e359fe1-7f00-4616-9685-6d8c609705db",
  "power_connectors": {
    "pcie_6_pin": 0,
    "pcie_8_pin": 0,
    "pcie_12VHPWR": 0,
    "pcie_12V_2x6": 0
  },
  "metadata": {
    "name": "MSI VANGUARD OC GeForce RTX 5070 Ti 16GB GDDR7 Black",
    "manufacturer": "MSI",
    "part_numbers": [
      "RTX 5070 Ti 16G VANGUARD OC                                                    GEFORCE RTX 5070 Ti 16G VANGUARD OC"
    ],
    "series": "GeForce RTX 5070 Ti",
    "variant": "MSI"
  },
  "chipset_manufacturer": "GeForce",
  "chipset": "GeForce RTX 5070 Ti",
  "memory": 16,
  "memory_type": "GDDR7",
  "core_base_clock": 2300,
  "core_boost_clock": 2580,
  "effective_memory_clock": 28000,
  "memory_bus": 256,
  "interface": "PCIe x16",
  "color": [
    "BLACK"
  ],
  "length": 357,
  "tdp": 300,
  "total_slot_width": 4,
  "cooling": "3 Fans",
  "video_outputs": {
    "hdmi_2_1": 1,
    "hdmi_2_0": 0,
    "displayport_2_1": 3,
    "displayport_2_1a": 0,
    "displayport_1_4a": 0,
    "dvi_d": 0,
    "vga": 0,
    "_id": "67f9c620865ad0c3553ea383"
  },
  "core_count": 8960,
  "general_product_information": {}
}