{
  "opendb_id": "21ddcda0-a675-412e-b60b-a5ce88e75fa7",
  "power_connectors": {
    "pcie_6_pin": 0,
    "pcie_8_pin": 1,
    "pcie_12VHPWR": 0,
    "pcie_12V_2x6": 0
  },
  "metadata": {
    "name": "MSI ARMOR OC GeForce GTX 1070 8GB GDDR5 Black / White",
    "manufacturer": "MSI",
    "part_numbers": [
      "GeForce GTX 1070 ARMOR 8G OC                                                    GTX 1070 ARMOR 8G OC                                                    V330-003R"
    ],
    "series": "GeForce GTX 1070",
    "variant": "MSI"
  },
  "chipset_manufacturer": "GeForce",
  "chipset": "GeForce GTX 1070",
  "memory": 8,
  "memory_type": "GDDR5",
  "core_base_clock": 1556,
  "core_boost_clock": 1746,
  "effective_memory_clock": 8008,
  "memory_bus": 0,
  "interface": "PCIe x16",
  "color": [
    "BLACK",
    "WHITE"
  ],
  "length": 279,
  "tdp": 150,
  "total_slot_width": 2,
  "cooling": "2 Fans",
  "video_outputs": {
    "hdmi_2_1": 0,
    "hdmi_2_0": 1,
    "displayport_2_1": 0,
    "displayport_2_1a": 0,
    "displayport_1_4a": 3,
    "dvi_d": 0,
    "vga": 0,
    "_id": "67f9c5d5865ad0c3553e9ebe"
  },
  "general_product_information": {}
}