{
  "opendb_id": "c95b4f51-5b5a-4dc4-912f-0516da012696",
  "power_connectors": {
    "pcie_6_pin": 0,
    "pcie_8_pin": 0,
    "pcie_12VHPWR": 0,
    "pcie_12V_2x6": 0
  },
  "metadata": {
    "name": "Inno3D Twin X2 OC GeForce RTX 3070 8GB GDDR6 Black",
    "manufacturer": "Inno3D",
    "part_numbers": [
      "N30702-08D6X-1710VA32L"
    ],
    "series": "GeForce RTX 3070",
    "variant": "Inno3D"
  },
  "chipset_manufacturer": "GeForce",
  "chipset": "GeForce RTX 3070",
  "memory": 8,
  "memory_type": "GDDR6",
  "core_base_clock": 1500,
  "core_boost_clock": 1740,
  "effective_memory_clock": 14000,
  "memory_bus": 0,
  "interface": "PCIe x16",
  "color": [
    "BLACK"
  ],
  "length": 240,
  "tdp": 220,
  "total_slot_width": 3,
  "cooling": "2 Fans",
  "video_outputs": {
    "hdmi_2_1": 0,
    "hdmi_2_0": 1,
    "displayport_2_1": 0,
    "displayport_2_1a": 0,
    "displayport_1_4a": 3,
    "dvi_d": 0,
    "vga": 0,
    "_id": "67f9c805865ad0c3553ec208"
  },
  "core_count": 5888,
  "general_product_information": {}
}