{
  "opendb_id": "86b5be0f-8314-4afe-adaf-f7adece18895",
  "power_connectors": {
    "pcie_6_pin": 0,
    "pcie_8_pin": 0,
    "pcie_12VHPWR": 0,
    "pcie_12V_2x6": 0
  },
  "metadata": {
    "name": "Gigabyte WINDFORCE OC GeForce GTX 1650 SUPER 4GB GDDR6 Black / Silver",
    "manufacturer": "Gigabyte",
    "part_numbers": [
      "GV-N165SWF2OC-4GD"
    ],
    "series": "GeForce GTX 1650 SUPER",
    "variant": "Gigabyte"
  },
  "chipset_manufacturer": "GeForce",
  "chipset": "GeForce GTX 1650 SUPER",
  "memory": 4,
  "memory_type": "GDDR6",
  "core_base_clock": 1530,
  "core_boost_clock": 1755,
  "effective_memory_clock": 12000,
  "memory_bus": 0,
  "interface": "PCIe x16",
  "color": [
    "BLACK",
    "GREY"
  ],
  "length": 225,
  "tdp": 100,
  "total_slot_width": 3,
  "cooling": "2 Fans",
  "video_outputs": {
    "hdmi_2_1": 0,
    "hdmi_2_0": 1,
    "displayport_2_1": 0,
    "displayport_2_1a": 0,
    "displayport_1_4a": 1,
    "dvi_d": 0,
    "vga": 0,
    "_id": "67f9c5bd865ad0c3553e9d37"
  },
  "general_product_information": {
    "amazon_sku": "B081R359ZM",
    "walmart_sku": 380423294
  }
}