{
  "opendb_id": "dcdb9442-e74f-4bdc-8785-11b651589afb",
  "power_connectors": {
    "pcie_6_pin": 0,
    "pcie_8_pin": 1,
    "pcie_12VHPWR": 0,
    "pcie_12V_2x6": 0
  },
  "metadata": {
    "name": "MSI ARMOR MK2 OC Radeon RX 580 8GB GDDR5 Red / Black",
    "manufacturer": "MSI",
    "part_numbers": [
      "RX 580 ARMOR MK2 8G OC"
    ],
    "series": "Radeon RX 580",
    "variant": "MSI"
  },
  "chipset_manufacturer": "Radeon",
  "chipset": "Radeon RX 580",
  "memory": 8,
  "memory_type": "GDDR5",
  "core_base_clock": 1340,
  "core_boost_clock": 1380,
  "effective_memory_clock": 8000,
  "memory_bus": 0,
  "interface": "PCIe x16",
  "color": [
    "RED",
    "BLACK"
  ],
  "length": 270,
  "tdp": 185,
  "total_slot_width": 2,
  "cooling": "2 Fans",
  "video_outputs": {
    "hdmi_2_1": 0,
    "hdmi_2_0": 2,
    "displayport_2_1": 0,
    "displayport_2_1a": 0,
    "displayport_1_4a": 2,
    "dvi_d": 0,
    "vga": 0,
    "_id": "67f9c81e865ad0c3553ec37e"
  },
  "general_product_information": {
    "amazon_sku": "B079NX4GCF",
    "walmart_sku": 999869873
  }
}