{
  "opendb_id": "5b6fc50e-cc0a-4143-a04b-88a43b10ea0a",
  "power_connectors": {
    "pcie_6_pin": 0,
    "pcie_8_pin": 1,
    "pcie_12VHPWR": 0,
    "pcie_12V_2x6": 0
  },
  "metadata": {
    "name": "MSI GAMING GeForce GTX 960 4GB GDDR5 Black / Red",
    "manufacturer": "MSI",
    "part_numbers": [
      "GTX 960 GAMING 4G                                                    V320-034R"
    ],
    "series": "GeForce GTX 960",
    "variant": "MSI"
  },
  "chipset_manufacturer": "GeForce",
  "chipset": "GeForce GTX 960",
  "memory": 4,
  "memory_type": "GDDR5",
  "core_base_clock": 1241,
  "core_boost_clock": 1304,
  "effective_memory_clock": 7010,
  "memory_bus": 0,
  "interface": "PCIe x16",
  "color": [
    "BLACK",
    "RED"
  ],
  "length": 267,
  "tdp": 120,
  "total_slot_width": 2,
  "cooling": "2 Fans",
  "video_outputs": {
    "hdmi_2_1": 0,
    "hdmi_2_0": 1,
    "displayport_2_1": 0,
    "displayport_2_1a": 0,
    "displayport_1_4a": 3,
    "dvi_d": 0,
    "vga": 0,
    "_id": "67f9c69d865ad0c3553eab4e"
  },
  "core_count": 0,
  "general_product_information": {}
}