{
  "opendb_id": "704a9c1b-fe7f-4614-9284-e9a99fc7b9e8",
  "power_connectors": {
    "pcie_6_pin": 0,
    "pcie_8_pin": 0,
    "pcie_12VHPWR": 0,
    "pcie_12V_2x6": 0
  },
  "metadata": {
    "name": "MSI GAMING TRIO GeForce RTX 5070 12GB GDDR7 Black",
    "manufacturer": "MSI",
    "part_numbers": [
      "RTX 5070 12G GAMING TRIO                                                    GEFORCE RTX 5070 12G GAMING TRIO"
    ],
    "series": "GeForce RTX 5070",
    "variant": "MSI"
  },
  "chipset_manufacturer": "GeForce",
  "chipset": "GeForce RTX 5070",
  "memory": 12,
  "memory_type": "GDDR7",
  "core_base_clock": 2160,
  "core_boost_clock": 2527,
  "effective_memory_clock": 28000,
  "memory_bus": 192,
  "interface": "PCIe x16",
  "color": [
    "BLACK"
  ],
  "length": 338,
  "tdp": 250,
  "total_slot_width": 3,
  "cooling": "3 Fans",
  "video_outputs": {
    "hdmi_2_1": 1,
    "hdmi_2_0": 0,
    "displayport_2_1": 3,
    "displayport_2_1a": 0,
    "displayport_1_4a": 0,
    "dvi_d": 0,
    "vga": 0,
    "_id": "684cd41e1d3a20a8514d34c8"
  },
  "core_count": 6144,
  "general_product_information": {}
}