{
  "opendb_id": "6b7f20ec-36f3-4ee5-a279-d1b7ea9b4be2",
  "power_connectors": {
    "pcie_6_pin": 0,
    "pcie_8_pin": 1,
    "pcie_12VHPWR": 0,
    "pcie_12V_2x6": 0
  },
  "metadata": {
    "name": "Asus Phoenix Fan GeForce RTX 2060 6GB GDDR6 Black / White",
    "manufacturer": "Asus",
    "part_numbers": [
      "PH-RTX2060-6G                                                    90YV0CJ0-M0NA00"
    ],
    "series": "GeForce RTX 2060",
    "variant": "Asus"
  },
  "chipset_manufacturer": "GeForce",
  "chipset": "GeForce RTX 2060",
  "memory": 6,
  "memory_type": "GDDR6",
  "core_base_clock": 1365,
  "core_boost_clock": 1710,
  "effective_memory_clock": 14000,
  "memory_bus": 0,
  "interface": "PCIe x16",
  "color": [
    "BLACK",
    "WHITE"
  ],
  "length": 177,
  "tdp": 160,
  "total_slot_width": 2,
  "cooling": "1 Fan",
  "video_outputs": {
    "hdmi_2_1": 0,
    "hdmi_2_0": 2,
    "displayport_2_1": 0,
    "displayport_2_1a": 0,
    "displayport_1_4a": 1,
    "dvi_d": 0,
    "vga": 0,
    "_id": "67f9c485865ad0c3553e8a39"
  },
  "general_product_information": {}
}