{
  "opendb_id": "5a149f8f-56ce-4bc9-9a12-8a62a2f3a411",
  "power_connectors": {
    "pcie_6_pin": 0,
    "pcie_8_pin": 0,
    "pcie_12VHPWR": 0,
    "pcie_12V_2x6": 0
  },
  "metadata": {
    "name": "XFX Mercury OC RGB Radeon RX 9070 XT 16GB GDDR6 Black",
    "manufacturer": "XFX",
    "part_numbers": [
      "RX-97TRGBBB9"
    ],
    "series": "Radeon RX 9070 XT",
    "variant": "XFX"
  },
  "chipset_manufacturer": "Radeon",
  "chipset": "Radeon RX 9070 XT",
  "core_count": 4096,
  "memory": 16,
  "memory_type": "GDDR6",
  "core_base_clock": 1870,
  "core_boost_clock": 3100,
  "effective_memory_clock": 20000,
  "memory_bus": 256,
  "interface": "PCIe x16",
  "color": [
    "BLACK"
  ],
  "length": 360,
  "tdp": 304,
  "total_slot_width": 4,
  "cooling": "3 Fans",
  "video_outputs": {
    "hdmi_2_1": 1,
    "hdmi_2_0": 0,
    "displayport_2_1": 3,
    "displayport_2_1a": 0,
    "displayport_1_4a": 0,
    "dvi_d": 0,
    "vga": 0,
    "_id": "67f9c7e1865ad0c3553ebf9e"
  },
  "general_product_information": {
    "amazon_sku": "B0DXW1R1YT",
    "newegg_sku": "N82E16814150899",
    "walmart_sku": 16319466785
  }
}