{
  "opendb_id": "cf5e6065-393e-4e8a-a4de-87201e185f9c",
  "power_connectors": {
    "pcie_6_pin": 0,
    "pcie_8_pin": 0,
    "pcie_12VHPWR": 0,
    "pcie_12V_2x6": 0
  },
  "metadata": {
    "name": "Zotac ZT-70605-10M GeForce GTX 750 Ti 2GB GDDR5 Black / Orange",
    "manufacturer": "Zotac",
    "part_numbers": [
      "ZT-70605-10M"
    ],
    "series": "GeForce GTX 750 Ti",
    "variant": "Zotac"
  },
  "chipset_manufacturer": "GeForce",
  "chipset": "GeForce GTX 750 Ti",
  "memory": 2,
  "memory_type": "GDDR5",
  "core_base_clock": 1033,
  "core_boost_clock": 1111,
  "effective_memory_clock": 5400,
  "memory_bus": 0,
  "interface": "PCIe x16",
  "color": [
    "BLACK",
    "ORANGE"
  ],
  "length": 145,
  "tdp": 60,
  "total_slot_width": 2,
  "cooling": "1 Fan",
  "video_outputs": {
    "hdmi_2_1": 0,
    "hdmi_2_0": 1,
    "displayport_2_1": 0,
    "displayport_2_1a": 0,
    "displayport_1_4a": 1,
    "dvi_d": 0,
    "vga": 0,
    "_id": "67f9c76d865ad0c3553eb869"
  },
  "core_count": 0,
  "general_product_information": {}
}