{
  "opendb_id": "55eecd3c-7fd5-4b44-82fe-3511cf344862",
  "power_connectors": {
    "pcie_6_pin": 0,
    "pcie_8_pin": 0,
    "pcie_12VHPWR": 0,
    "pcie_12V_2x6": 0
  },
  "metadata": {
    "name": "MSI GAMING X TRIO Radeon RX 6800 16GB GDDR6 Black Silver",
    "manufacturer": "MSI",
    "part_numbers": [
      "RX6800GAMINGXTRIO16G                                                    Radeon RX 6800 GAMING X TRIO 16G                                                    R6800GXT16                                                    V396-002R"
    ],
    "series": "Radeon RX 6800",
    "variant": "MSI"
  },
  "chipset_manufacturer": "Radeon",
  "chipset": "Radeon RX 6800",
  "memory": 16,
  "memory_type": "GDDR6",
  "core_base_clock": 1700,
  "core_boost_clock": 2155,
  "effective_memory_clock": 0,
  "memory_bus": 0,
  "interface": "PCIe x16",
  "color": [
    "BLACK",
    "GREY"
  ],
  "length": 324,
  "tdp": 250,
  "total_slot_width": 3,
  "cooling": "3 Fans",
  "video_outputs": {
    "hdmi_2_1": 1,
    "hdmi_2_0": 0,
    "displayport_2_1": 0,
    "displayport_2_1a": 0,
    "displayport_1_4a": 3,
    "dvi_d": 0,
    "vga": 0,
    "_id": "67f9c490865ad0c3553e8afa"
  },
  "core_count": 3840,
  "general_product_information": {
    "amazon_sku": "B08RHQC4KQ"
  }
}