{
  "opendb_id": "9ecffaca-6b08-4b10-ac76-f2608ddaef0c",
  "power_connectors": {
    "pcie_6_pin": 0,
    "pcie_8_pin": 0,
    "pcie_12VHPWR": 0,
    "pcie_12V_2x6": 0
  },
  "metadata": {
    "name": "MSI GeForce GT 1030 Black 2GB GDDR5",
    "manufacturer": "MSI",
    "part_numbers": [
      "GT 1030 2G LP OC"
    ],
    "series": "GeForce GT 1030",
    "variant": "MSI"
  },
  "chipset_manufacturer": "GeForce",
  "chipset": "GeForce GT 1030",
  "memory": 2,
  "memory_type": "GDDR5",
  "core_base_clock": 1265,
  "core_boost_clock": 1518,
  "effective_memory_clock": 6008,
  "memory_bus": 0,
  "interface": "PCIe x16",
  "color": [
    "BLACK"
  ],
  "length": 159,
  "tdp": 30,
  "total_slot_width": 1,
  "cooling": "1 Fan",
  "video_outputs": {
    "hdmi_2_1": 0,
    "hdmi_2_0": 1,
    "displayport_2_1": 0,
    "displayport_2_1a": 0,
    "displayport_1_4a": 1,
    "dvi_d": 0,
    "vga": 0,
    "_id": "67f9c678865ad0c3553ea900"
  },
  "general_product_information": {}
}