{
  "opendb_id": "2e1ddcdb-3ef3-486f-a7bb-32a9c52236cc",
  "power_connectors": {
    "pcie_6_pin": 0,
    "pcie_8_pin": 0,
    "pcie_12VHPWR": 0,
    "pcie_12V_2x6": 0
  },
  "metadata": {
    "name": "Gigabyte AERO OC GeForce RTX 4070 Ti SUPER 16GB GDDR6X White / Silver",
    "manufacturer": "Gigabyte",
    "part_numbers": [
      "GV-N407TSAERO OC-16GD"
    ],
    "series": "GeForce RTX 4070 Ti SUPER",
    "variant": "Gigabyte"
  },
  "chipset_manufacturer": "GeForce",
  "chipset": "GeForce RTX 4070 Ti SUPER",
  "memory": 16,
  "memory_type": "GDDR6X",
  "core_base_clock": 2340,
  "core_boost_clock": 2655,
  "effective_memory_clock": 0,
  "memory_bus": 0,
  "interface": "PCIe x16",
  "color": [
    "WHITE",
    "GREY"
  ],
  "length": 300,
  "tdp": 285,
  "total_slot_width": 3,
  "cooling": "3 Fans",
  "video_outputs": {
    "hdmi_2_1": 1,
    "hdmi_2_0": 0,
    "displayport_2_1": 0,
    "displayport_2_1a": 0,
    "displayport_1_4a": 3,
    "dvi_d": 0,
    "vga": 0,
    "_id": "67f9c7ab865ad0c3553ebc2f"
  },
  "core_count": 8448,
  "general_product_information": {
    "amazon_sku": "B0CSK2GJXP",
    "bestbuy_sku": 6572569,
    "walmart_sku": 5284676541
  }
}