{
  "opendb_id": "bc8d2fd8-c2d6-4de3-a6a6-6c4751a369dc",
  "power_connectors": {
    "pcie_6_pin": 0,
    "pcie_8_pin": 2,
    "pcie_12VHPWR": 0,
    "pcie_12V_2x6": 0
  },
  "metadata": {
    "name": "Asus GeForce RTX 3070 LHR KO GAMING OC V2 8GB GDDR6 Black / Silver",
    "manufacturer": "Asus",
    "part_numbers": [
      "KO-RTX3070-O8G-V2-GAMING"
    ],
    "series": "GeForce RTX 3070 LHR",
    "variant": "Asus"
  },
  "chipset_manufacturer": "GeForce",
  "chipset": "GeForce RTX 3070",
  "memory": 8,
  "memory_type": "GDDR6",
  "core_base_clock": 1500,
  "core_boost_clock": 1845,
  "effective_memory_clock": 14000,
  "memory_bus": 0,
  "interface": "PCIe x16",
  "color": [
    "BLACK",
    "GREY"
  ],
  "length": 275,
  "tdp": 220,
  "total_slot_width": 3,
  "cooling": "2 Fans",
  "video_outputs": {
    "hdmi_2_1": 0,
    "hdmi_2_0": 2,
    "displayport_2_1": 0,
    "displayport_2_1a": 0,
    "displayport_1_4a": 3,
    "dvi_d": 0,
    "vga": 0,
    "_id": "67f9c722865ad0c3553eb3b4"
  },
  "core_count": 5888,
  "general_product_information": {
    "amazon_sku": "B09CC36XXC",
    "walmart_sku": 717838991
  }
}