{
  "opendb_id": "95da722a-b816-44ee-90e3-f3d8395c0b88",
  "power_connectors": {
    "pcie_6_pin": 0,
    "pcie_8_pin": 0,
    "pcie_12VHPWR": 0,
    "pcie_12V_2x6": 0
  },
  "metadata": {
    "name": "Gigabyte XTREME WATERFORCE GeForce RTX 5080 16GB GDDR7 Black",
    "manufacturer": "Gigabyte",
    "part_numbers": [
      "GV-N5080AORUSX W-16GD"
    ],
    "series": "GeForce RTX 5080",
    "variant": "Gigabyte"
  },
  "chipset_manufacturer": "GeForce",
  "chipset": "GeForce RTX 5080",
  "memory": 16,
  "memory_type": "GDDR7",
  "core_base_clock": 2300,
  "core_boost_clock": 2805,
  "effective_memory_clock": 30000,
  "memory_bus": 256,
  "interface": "PCIe x16",
  "color": [
    "BLACK"
  ],
  "length": 220,
  "tdp": 360,
  "total_slot_width": 2,
  "cooling": "360 mm Radiator",
  "video_outputs": {
    "hdmi_2_1": 1,
    "hdmi_2_0": 0,
    "displayport_2_1": 3,
    "displayport_2_1a": 0,
    "displayport_1_4a": 0,
    "dvi_d": 0,
    "vga": 0,
    "_id": "67f9c827865ad0c3553ec418"
  },
  "core_count": 10752,
  "general_product_information": {
    "amazon_sku": "B0DT7HKND2",
    "newegg_sku": "N82E16814932759",
    "bestbuy_sku": 6615927,
    "walmart_sku": 15770064499
  }
}