{
  "opendb_id": "a661e067-be7d-42c3-977a-c0ff8d91ce13",
  "power_connectors": {
    "pcie_6_pin": 0,
    "pcie_8_pin": 0,
    "pcie_12VHPWR": 0,
    "pcie_12V_2x6": 0
  },
  "metadata": {
    "name": "ASRock Low Profile Arc A380 6 GB",
    "manufacturer": "ASRock",
    "part_numbers": [
      "A380 LP 6G                                                    90-G46ZZ-00UANF"
    ],
    "series": "Arc A380",
    "variant": "ASRock"
  },
  "chipset_manufacturer": "Arc",
  "chipset": "Arc A380",
  "memory": 6,
  "memory_type": "GDDR6",
  "core_base_clock": 2000,
  "core_boost_clock": 2000,
  "effective_memory_clock": 0,
  "memory_bus": 0,
  "interface": "PCIe x16",
  "frame_sync": "None",
  "length": 169,
  "tdp": 75,
  "case_expansion_slot_width": 1,
  "total_slot_width": 2,
  "cooling": "2 Fans",
  "video_outputs": {
    "hdmi_2_1": 0,
    "hdmi_2_0": 0,
    "displayport_2_1": 0,
    "displayport_2_1a": 0,
    "displayport_1_4a": 0,
    "dvi_d": 0,
    "vga": 0,
    "_id": "67e89c7a11815510c7c7ad20"
  },
  "color": [],
  "core_count": 1024,
  "general_product_information": {}
}