{
  "opendb_id": "2dd37c3e-3a78-43c7-bae7-9b170e3065e1",
  "power_connectors": {
    "pcie_6_pin": 0,
    "pcie_8_pin": 1,
    "pcie_12VHPWR": 0,
    "pcie_12V_2x6": 0
  },
  "metadata": {
    "name": "Sapphire NITRO+ SE Radeon RX 5500 XT 8GB GDDR6 Black",
    "manufacturer": "Sapphire",
    "part_numbers": [
      "11295-05-20G                                                    100418NT+8GSEL"
    ],
    "series": "Radeon RX 5500 XT",
    "variant": "Sapphire"
  },
  "chipset_manufacturer": "Radeon",
  "chipset": "Radeon RX 5500 XT",
  "memory": 8,
  "memory_type": "GDDR6",
  "core_base_clock": 1607,
  "core_boost_clock": 1845,
  "effective_memory_clock": 14400,
  "memory_bus": 0,
  "interface": "PCIe x16",
  "color": [
    "BLACK"
  ],
  "length": 257,
  "tdp": 135,
  "total_slot_width": 3,
  "cooling": "2 Fans",
  "video_outputs": {
    "hdmi_2_1": 0,
    "hdmi_2_0": 1,
    "displayport_2_1": 0,
    "displayport_2_1a": 0,
    "displayport_1_4a": 3,
    "dvi_d": 0,
    "vga": 0,
    "_id": "67f9c79c865ad0c3553ebb4e"
  },
  "general_product_information": {}
}